{
  "schema_version": "1.1.0",
  "is_mock": true,
  "reference_period": "2026Q2",
  "display_disclaimer": "APP-01 개발용 가짜 데이터이며 실제 추천 결과가 아닙니다.",
  "brands": [
    {
      "brand_id": "BRAND-MOCK-A",
      "brand_name": "가상 브랜드 A",
      "brand_type": "도심 업무형",
      "dna_summary": {
        "evidence_store_count": 48,
        "headline": "직장인 소비와 평일 거래가 활발한 도심 환경에 적합한 가상 브랜드",
        "strengths": [
          "30~40대 소비 비중",
          "업무지구 수요",
          "높은 거래건수"
        ],
        "cautions": [
          "높은 경쟁 수준",
          "기존 점포 근접 위험"
        ]
      },
      "recommendations": [
        {
          "area_id": "MOCK-A001",
          "area_name": "여의도역 상권",
          "district_nm": "영등포구",
          "centroid_latitude": 37.5219,
          "centroid_longitude": 126.9245,
          "suitability_score": 83.2,
          "score_components": {
            "dna_match_score": 92.4,
            "market_score": 86.4,
            "proximity_risk_score": 60.0,
            "competition_attractiveness_score": 78.0
          },
          "positive_factors": [
            "브랜드 DNA와 매우 유사한 소비환경",
            "시장 활동성이 높은 후보",
            "프랜차이즈 경쟁 부담이 상대적으로 낮음"
          ],
          "risk_factors": [
            "가장 가까운 기존 점포와 약 800m로 근접 위험 확인 필요"
          ],
          "facts": {
            "min_distance_to_existing_store_m": 800,
            "bakery_franchise_share": 0.22
          },
          "consumer_profile": {
            "primary_segment": "30~40대 직장인",
            "demand_context": "평일 업무 수요",
            "avg_ticket_band": "중간"
          },
          "data_quality": {
            "coverage_score": 91.0,
            "confidence_label": "높음",
            "is_mock": true
          },
          "next_checks": [
            "실제 임대료와 공실 여부",
            "요일·시간대별 유동인구",
            "가시성과 접근성",
            "기존 점포와의 실제 고객시장 중복"
          ],
          "rank": 1,
          "recommendation_label": "최우선 검토"
        },
        {
          "area_id": "MOCK-A002",
          "area_name": "강남역 남부 상권",
          "district_nm": "강남구",
          "centroid_latitude": 37.4979,
          "centroid_longitude": 127.0276,
          "suitability_score": 82.1,
          "score_components": {
            "dna_match_score": 89.7,
            "market_score": 84.7,
            "proximity_risk_score": 48.5,
            "competition_attractiveness_score": 74.5
          },
          "positive_factors": [
            "브랜드 DNA와 유사한 소비환경",
            "시장 활동성이 양호한 후보",
            "프랜차이즈 경쟁 부담이 상대적으로 낮음"
          ],
          "risk_factors": [
            "가장 가까운 기존 점포와 약 1030m로 중간 수준의 근접 검토 필요"
          ],
          "facts": {
            "min_distance_to_existing_store_m": 1030,
            "bakery_franchise_share": 0.255
          },
          "consumer_profile": {
            "primary_segment": "20~40대 직장인·방문객",
            "demand_context": "업무·광역 방문 수요",
            "avg_ticket_band": "중상"
          },
          "data_quality": {
            "coverage_score": 87.0,
            "confidence_label": "높음",
            "is_mock": true
          },
          "next_checks": [
            "실제 임대료와 공실 여부",
            "요일·시간대별 유동인구",
            "가시성과 접근성",
            "기존 점포와의 실제 고객시장 중복"
          ],
          "rank": 2,
          "recommendation_label": "우선 검토"
        },
        {
          "area_id": "MOCK-A003",
          "area_name": "서울역 동부 상권",
          "district_nm": "중구",
          "centroid_latitude": 37.5559,
          "centroid_longitude": 126.9723,
          "suitability_score": 80.9,
          "score_components": {
            "dna_match_score": 86.9,
            "market_score": 82.9,
            "proximity_risk_score": 37.0,
            "competition_attractiveness_score": 71.0
          },
          "positive_factors": [
            "브랜드 DNA와 유사한 소비환경",
            "시장 활동성이 양호한 후보",
            "프랜차이즈 경쟁 부담이 상대적으로 낮음"
          ],
          "risk_factors": [
            "제과점 중 프랜차이즈 비중이 29%로 추가 경쟁 검토 필요",
            "가장 가까운 기존 점포와 약 1260m로 중간 수준의 근접 검토 필요"
          ],
          "facts": {
            "min_distance_to_existing_store_m": 1260,
            "bakery_franchise_share": 0.29
          },
          "consumer_profile": {
            "primary_segment": "직장인·이동 고객",
            "demand_context": "업무·교통 환승 수요",
            "avg_ticket_band": "중간"
          },
          "data_quality": {
            "coverage_score": 83.0,
            "confidence_label": "보통",
            "is_mock": true
          },
          "next_checks": [
            "실제 임대료와 공실 여부",
            "요일·시간대별 유동인구",
            "가시성과 접근성",
            "기존 점포와의 실제 고객시장 중복"
          ],
          "rank": 3,
          "recommendation_label": "우선 검토"
        },
        {
          "area_id": "MOCK-A004",
          "area_name": "상암 DMC 상권",
          "district_nm": "마포구",
          "centroid_latitude": 37.5795,
          "centroid_longitude": 126.8899,
          "suitability_score": 79.5,
          "score_components": {
            "dna_match_score": 83.8,
            "market_score": 80.8,
            "proximity_risk_score": 25.5,
            "competition_attractiveness_score": 67.5
          },
          "positive_factors": [
            "브랜드 DNA와 유사한 소비환경",
            "시장 활동성이 양호한 후보"
          ],
          "risk_factors": [
            "제과점 중 프랜차이즈 비중이 32%로 추가 경쟁 검토 필요",
            "가장 가까운 기존 점포와 약 1490m로 중간 수준의 근접 검토 필요"
          ],
          "facts": {
            "min_distance_to_existing_store_m": 1490,
            "bakery_franchise_share": 0.325
          },
          "consumer_profile": {
            "primary_segment": "30~40대 직장인",
            "demand_context": "평일 업무 수요",
            "avg_ticket_band": "중간"
          },
          "data_quality": {
            "coverage_score": 79.0,
            "confidence_label": "보통",
            "is_mock": true
          },
          "next_checks": [
            "실제 임대료와 공실 여부",
            "요일·시간대별 유동인구",
            "가시성과 접근성",
            "기존 점포와의 실제 고객시장 중복"
          ],
          "rank": 4,
          "recommendation_label": "비교 후보"
        },
        {
          "area_id": "MOCK-A005",
          "area_name": "잠실역 상권",
          "district_nm": "송파구",
          "centroid_latitude": 37.5133,
          "centroid_longitude": 127.1001,
          "suitability_score": 78.7,
          "score_components": {
            "dna_match_score": 81.5,
            "market_score": 79.5,
            "proximity_risk_score": 14.0,
            "competition_attractiveness_score": 64.0
          },
          "positive_factors": [
            "브랜드 DNA와 유사한 소비환경",
            "시장 활동성이 양호한 후보"
          ],
          "risk_factors": [
            "제과점 중 프랜차이즈 비중이 36%로 높은 편"
          ],
          "facts": {
            "min_distance_to_existing_store_m": 1720,
            "bakery_franchise_share": 0.36
          },
          "consumer_profile": {
            "primary_segment": "가족·방문 고객",
            "demand_context": "생활·여가 복합 수요",
            "avg_ticket_band": "중상"
          },
          "data_quality": {
            "coverage_score": 75.0,
            "confidence_label": "보통",
            "is_mock": true
          },
          "next_checks": [
            "실제 임대료와 공실 여부",
            "요일·시간대별 유동인구",
            "가시성과 접근성",
            "기존 점포와의 실제 고객시장 중복"
          ],
          "rank": 5,
          "recommendation_label": "비교 후보"
        }
      ],
      "portfolios": [
        {
          "desired_store_count": 1,
          "area_ids": [
            "MOCK-A001"
          ],
          "area_names": [
            "여의도역 상권"
          ],
          "portfolio_score": 83.2,
          "score_components": {
            "average_area_score": 83.2,
            "geographic_diversification_score": null,
            "consumer_diversification_score": null,
            "overlap_risk_score": null
          },
          "rationale_facts": [
            "개별 상권 적합도가 가장 높은 후보"
          ],
          "risk_factors": [
            "기존 점포 근접 검토 필요: 여의도역 상권"
          ],
          "next_checks": [
            "후보별 임대료와 예상 고정비 비교",
            "현장 유동과 접근성 확인",
            "출점 순서와 운영인력 배치 검토"
          ],
          "portfolio_rank": 1
        },
        {
          "desired_store_count": 1,
          "area_ids": [
            "MOCK-A002"
          ],
          "area_names": [
            "강남역 남부 상권"
          ],
          "portfolio_score": 82.1,
          "score_components": {
            "average_area_score": 82.1,
            "geographic_diversification_score": null,
            "consumer_diversification_score": null,
            "overlap_risk_score": null
          },
          "rationale_facts": [
            "개별 상권 적합도가 가장 높은 후보"
          ],
          "risk_factors": [
            "집계데이터 기준 큰 조합 위험은 없으나 현장조사 필요"
          ],
          "next_checks": [
            "후보별 임대료와 예상 고정비 비교",
            "현장 유동과 접근성 확인",
            "출점 순서와 운영인력 배치 검토"
          ],
          "portfolio_rank": 2
        },
        {
          "desired_store_count": 1,
          "area_ids": [
            "MOCK-A003"
          ],
          "area_names": [
            "서울역 동부 상권"
          ],
          "portfolio_score": 80.9,
          "score_components": {
            "average_area_score": 80.9,
            "geographic_diversification_score": null,
            "consumer_diversification_score": null,
            "overlap_risk_score": null
          },
          "rationale_facts": [
            "개별 상권 적합도가 가장 높은 후보"
          ],
          "risk_factors": [
            "집계데이터 기준 큰 조합 위험은 없으나 현장조사 필요"
          ],
          "next_checks": [
            "후보별 임대료와 예상 고정비 비교",
            "현장 유동과 접근성 확인",
            "출점 순서와 운영인력 배치 검토"
          ],
          "portfolio_rank": 3
        },
        {
          "desired_store_count": 2,
          "area_ids": [
            "MOCK-A001",
            "MOCK-A005"
          ],
          "area_names": [
            "여의도역 상권",
            "잠실역 상권"
          ],
          "portfolio_score": 85.7,
          "score_components": {